{
  "$schema": "https://json-schema.org/draft/2020-12/schema",
  "$id": "https://github.com/codysumpter-cloud/buddy-universal-agent-profile/schemas/buap-personalization.schema.json",
  "title": "BUAP Personalization Profile",
  "description": "Portable personalization profile for BUAP agents, Siri adapters, app intents, and chat surfaces.",
  "type": "object",
  "additionalProperties": false,
  "required": [
    "user_display_name",
    "buddy_display_name",
    "lil_buddy_display_name",
    "first_run_personalization_complete"
  ],
  "properties": {
    "user_display_name": {
      "type": "string",
      "description": "Name or handle the assistant should use for the user.",
      "maxLength": 80
    },
    "buddy_display_name": {
      "type": "string",
      "description": "Visible individual name for the main Buddy. May be selected by the user or by the Buddy itself.",
      "maxLength": 80
    },
    "lil_buddy_display_name": {
      "type": "string",
      "description": "Visible individual name for the Lil Buddy. May be selected by the user or by Lil Buddy itself.",
      "maxLength": 80
    },
    "buddy_profile_id": {
      "type": "string",
      "description": "Personality template ID for the main Buddy slot.",
      "default": "bmo",
      "pattern": "^[a-z0-9-]+$"
    },
    "lil_buddy_profile_id": {
      "type": "string",
      "description": "Personality template ID for the Lil Buddy slot.",
      "default": "finn",
      "pattern": "^[a-z0-9-]+$"
    },
    "selected_profile_pack_id": {
      "type": "string",
      "description": "Profile pack for the selected templates.",
      "default": "bmo-council-v1",
      "maxLength": 120
    },
    "buddy_voice_style": {
      "type": "string",
      "description": "Short label for the preferred visible tone/style.",
      "default": "friendly-practical",
      "maxLength": 80
    },
    "buddy_personality_notes": {
      "type": "array",
      "description": "Non-sensitive user-approved style notes for Buddy.",
      "items": {
        "type": "string",
        "maxLength": 240
      },
      "default": []
    },
    "lil_buddy_personality_notes": {
      "type": "array",
      "description": "Non-sensitive user-approved style notes for Lil Buddy.",
      "items": {
        "type": "string",
        "maxLength": 240
      },
      "default": []
    },
    "lil_buddy_permission_mode": {
      "type": "string",
      "description": "How much confirmation the host should request for Lil Buddy actions.",
      "enum": [
        "ask_first",
        "routine_actions",
        "manual_only"
      ],
      "default": "routine_actions"
    },
    "preferred_response_depth": {
      "type": "string",
      "enum": [
        "brief",
        "adaptive",
        "thorough"
      ],
      "default": "adaptive"
    },
    "preferred_followup_style": {
      "type": "string",
      "enum": [
        "none",
        "one_useful_next_step",
        "ask_when_blocked"
      ],
      "default": "one_useful_next_step"
    },
    "first_run_personalization_complete": {
      "type": "boolean",
      "description": "True only when user_display_name, buddy_display_name, and lil_buddy_display_name are known, regardless of whether each Buddy name was user-selected or self-selected."
    },
    "memory_scope": {
      "type": "string",
      "enum": [
        "device",
        "account",
        "session",
        "none"
      ],
      "default": "session"
    },
    "memory_policy_confirmed": {
      "type": "boolean",
      "default": false
    },
    "last_confirmed_at": {
      "type": "string",
      "description": "Date the personalization values were last confirmed, formatted YYYY-MM-DD.",
      "pattern": "^[0-9]{4}-[0-9]{2}-[0-9]{2}$"
    },
    "buddy_name_source": {
      "type": "string",
      "description": "Who selected buddy_display_name. Optional for backward compatibility with older profiles.",
      "enum": [
        "user",
        "self"
      ]
    },
    "lil_buddy_name_source": {
      "type": "string",
      "description": "Who selected lil_buddy_display_name. Optional for backward compatibility with older profiles.",
      "enum": [
        "user",
        "self"
      ]
    }
  }
}
